{"$id":"https://closy.local/schemas/v1/closy-sleeveless-top-pattern-d0.schema.json","$schema":"https://json-schema.org/draft/2020-12/schema","additionalProperties":false,"properties":{"garmentClass":{"const":"sleeveless_top"},"garmentId":{"const":"garment.demo_sleeveless_top.reference_v1"},"openings":{"maxItems":4,"minItems":4,"type":"array"},"panels":{"maxItems":2,"minItems":2,"type":"array"},"parameters":{"type":"object"},"patternVersion":{"type":"string"},"provenance":{"type":"object"},"schemaVersion":{"const":1},"seams":{"maxItems":4,"minItems":4,"type":"array"},"units":{"const":"metres"}},"required":["schemaVersion","patternVersion","garmentId","garmentClass","units","parameters","panels","seams","openings","provenance"],"title":"Closy sleeveless top pattern D0","type":"object"}
