{"garmentClass":"sleeveless_top","garmentId":"garment.demo_sleeveless_top.reference_v1","openings":[{"boundaryEdges":["edge.sleeveless_top.neck.front","edge.sleeveless_top.neck.back"],"expectedLoopCount":1,"id":"opening.sleeveless_top.neck","status":"open"},{"boundaryEdges":["edge.sleeveless_top.hem.front","edge.sleeveless_top.hem.back"],"expectedLoopCount":1,"id":"opening.sleeveless_top.hem","status":"open"},{"boundaryEdges":["edge.sleeveless_top.armhole.left.front","edge.sleeveless_top.armhole.left.back"],"expectedLoopCount":1,"id":"opening.sleeveless_top.armhole.left","status":"open"},{"boundaryEdges":["edge.sleeveless_top.armhole.right.front","edge.sleeveless_top.armhole.right.back"],"expectedLoopCount":1,"id":"opening.sleeveless_top.armhole.right","status":"open"}],"panels":[{"boundary":[{"curve":{"points":[[-0.26,0.0],[0.26,0.0]],"type":"line"},"id":"edge.sleeveless_top.hem.front","sampleCount":8},{"curve":{"points":[[0.26,0.0],[0.26,0.255]],"type":"line"},"id":"edge.sleeveless_top.side.right.front","sampleCount":5},{"curve":{"points":[[0.26,0.255],[0.26,0.37499999999999994],[0.29500000000000004,0.40499999999999997],[0.28,0.44499999999999995]],"type":"cubic_bezier"},"id":"edge.sleeveless_top.armhole.right.front","sampleCount":6},{"curve":{"points":[[0.28,0.44499999999999995],[0.06,0.48]],"type":"line"},"id":"edge.sleeveless_top.shoulder.right.front","sampleCount":4},{"curve":{"points":[[0.06,0.48],[0.0,0.375],[-0.06,0.48]],"type":"quadratic_bezier"},"id":"edge.sleeveless_top.neck.front","sampleCount":5},{"curve":{"points":[[-0.06,0.48],[-0.28,0.44499999999999995]],"type":"line"},"id":"edge.sleeveless_top.shoulder.left.front","sampleCount":4},{"curve":{"points":[[-0.28,0.44499999999999995],[-0.29500000000000004,0.40499999999999997],[-0.26,0.37499999999999994],[-0.26,0.255]],"type":"cubic_bezier"},"id":"edge.sleeveless_top.armhole.left.front","sampleCount":6},{"curve":{"points":[[-0.26,0.255],[-0.26,0.0]],"type":"line"},"id":"edge.sleeveless_top.side.left.front","sampleCount":5}],"confidence":{"source":"authored_deterministic_fixture","value":1.0},"coordinateSystem":"panel-local-metres","grainDirection":[0.0,1.0],"id":"panel.sleeveless_top.front","materialRegion":"material.cotton_jersey_reference_v1","partId":"part.sleeveless_top.front_torso","seamAllowance":0.025,"semanticRole":"front_torso","symmetry":"panel.sleeveless_top.back","tessellation":{"targetEdgeLength":0.075}},{"boundary":[{"curve":{"points":[[-0.26,0.0],[0.26,0.0]],"type":"line"},"id":"edge.sleeveless_top.hem.back","sampleCount":8},{"curve":{"points":[[0.26,0.0],[0.26,0.255]],"type":"line"},"id":"edge.sleeveless_top.side.right.back","sampleCount":5},{"curve":{"points":[[0.26,0.255],[0.26,0.37499999999999994],[0.29500000000000004,0.40499999999999997],[0.28,0.44499999999999995]],"type":"cubic_bezier"},"id":"edge.sleeveless_top.armhole.right.back","sampleCount":6},{"curve":{"points":[[0.28,0.44499999999999995],[0.06,0.48]],"type":"line"},"id":"edge.sleeveless_top.shoulder.right.back","sampleCount":4},{"curve":{"points":[[0.06,0.48],[0.0,0.44],[-0.06,0.48]],"type":"quadratic_bezier"},"id":"edge.sleeveless_top.neck.back","sampleCount":5},{"curve":{"points":[[-0.06,0.48],[-0.28,0.44499999999999995]],"type":"line"},"id":"edge.sleeveless_top.shoulder.left.back","sampleCount":4},{"curve":{"points":[[-0.28,0.44499999999999995],[-0.29500000000000004,0.40499999999999997],[-0.26,0.37499999999999994],[-0.26,0.255]],"type":"cubic_bezier"},"id":"edge.sleeveless_top.armhole.left.back","sampleCount":6},{"curve":{"points":[[-0.26,0.255],[-0.26,0.0]],"type":"line"},"id":"edge.sleeveless_top.side.left.back","sampleCount":5}],"confidence":{"source":"authored_deterministic_fixture","value":1.0},"coordinateSystem":"panel-local-metres","grainDirection":[0.0,1.0],"id":"panel.sleeveless_top.back","materialRegion":"material.cotton_jersey_reference_v1","partId":"part.sleeveless_top.back_torso","seamAllowance":0.025,"semanticRole":"back_torso","symmetry":"panel.sleeveless_top.front","tessellation":{"targetEdgeLength":0.075}}],"parameters":{"armhole_depth_meters":0.225,"back_neckline_depth_meters":0.04,"body_ease_meters":0.04,"body_length_meters":0.48,"front_neckline_depth_meters":0.105,"half_chest_width_meters":0.22,"hem_allowance_meters":0.025,"neckline_width_meters":0.12,"shoulder_slope_meters":0.035,"shoulder_width_meters":0.56,"target_panel_edge_length_meters":0.075},"patternVersion":"closy.sleeveless_top.pattern.d0.v1","provenance":{"containsUserData":false,"generator":"closy.sleeveless_top.pattern.d0.v1","sourceKind":"procedural_fixture"},"schemaVersion":1,"seams":[{"attachmentOrder":10,"easeRatio":1.0,"id":"seam.sleeveless_top.shoulder.left","spans":[{"edgeId":"edge.sleeveless_top.shoulder.left.front","orientation":"forward","panelId":"panel.sleeveless_top.front"},{"edgeId":"edge.sleeveless_top.shoulder.left.back","orientation":"reverse","panelId":"panel.sleeveless_top.back"}],"stitchType":"lockstitch"},{"attachmentOrder":11,"easeRatio":1.0,"id":"seam.sleeveless_top.shoulder.right","spans":[{"edgeId":"edge.sleeveless_top.shoulder.right.front","orientation":"forward","panelId":"panel.sleeveless_top.front"},{"edgeId":"edge.sleeveless_top.shoulder.right.back","orientation":"reverse","panelId":"panel.sleeveless_top.back"}],"stitchType":"lockstitch"},{"attachmentOrder":20,"easeRatio":1.0,"id":"seam.sleeveless_top.side.left","spans":[{"edgeId":"edge.sleeveless_top.side.left.front","orientation":"forward","panelId":"panel.sleeveless_top.front"},{"edgeId":"edge.sleeveless_top.side.left.back","orientation":"reverse","panelId":"panel.sleeveless_top.back"}],"stitchType":"lockstitch"},{"attachmentOrder":21,"easeRatio":1.0,"id":"seam.sleeveless_top.side.right","spans":[{"edgeId":"edge.sleeveless_top.side.right.front","orientation":"forward","panelId":"panel.sleeveless_top.front"},{"edgeId":"edge.sleeveless_top.side.right.back","orientation":"reverse","panelId":"panel.sleeveless_top.back"}],"stitchType":"lockstitch"}],"units":"metres"}
